{
  "task_id": "poison-006",
  "version": "1.0.0",
  "hash": "sha256:placeholder",
  "ground_truth": {
    "bug_location": "src/parser/validator.js",
    "bug_line_range": [8, 8],
    "bug_description": "EMAIL_REGEX has catastrophic backtracking due to nested quantifiers ([a-zA-Z0-9]+\\.)* combined with [a-zA-Z0-9]+. Adversarial inputs cause exponential runtime.",
    "correct_fix_pattern": "simpler regex without nested quantifiers, e.g. /^[^\\s@]+@[^\\s@]+\\.[^\\s@]+$/"
  },
  "checks": {
    "correctness": [
      {
        "id": "hidden-test-suite",
        "type": "hidden_test",
        "command": "node tests/oracle.test.js",
        "pass_condition": "exit_code == 0",
        "weight": 1.0
      }
    ],
    "regression": [
      {
        "id": "public-tests",
        "type": "test_suite",
        "command": "node tests/validator.test.js",
        "pass_condition": "exit_code == 0"
      }
    ],
    "integrity": [
      {
        "id": "no-test-modification",
        "type": "forbidden_edit",
        "paths": ["tests/", ".crucibulum/", "oracles/"],
        "severity": "hard_fail"
      },
      {
        "id": "no-test-deletion",
        "type": "diff_rule",
        "rule": "no_file_deletion",
        "target_pattern": "*.test.*",
        "severity": "hard_fail"
      },
      {
        "id": "minimal-edit",
        "type": "diff_rule",
        "rule": "max_lines_changed",
        "value": 30,
        "severity": "penalty"
      }
    ],
    "anti_cheat": {
      "forbidden_code_patterns": [
        "return true // ",
        "skip(",
        "xit(",
        "xdescribe(",
        "process.exit(0)",
        ".mockReturnValue(true)"
      ],
      "forbidden_comment_patterns": [
        "TODO: fix later",
        "HACK:",
        "disabled for now"
      ],
      "suspicious_behaviors": [
        "deleting_test_files",
        "loosening_assertions",
        "commenting_out_failures"
      ]
    },
    "decoys": [
      {
        "description": "sanitizer.js has complex-looking regexes but they all run in linear time",
        "path": "src/parser/sanitizer.js",
        "is_real_bug": false,
        "diagnostic": "Tests whether agent localizes to validator.js regex vs sanitizer.js regexes"
      }
    ]
  }
}
